Participants,Strawberry,Coffee Beans,Burger,Banana
006 (nomy),"Artificial: ""Very different"" (1/7) from real; smelled like ""toothpaste.""
Real: Rated 4/7 vs. an ""ideal"" garden strawberry, which is much stronger.

Oh, that's a very strong reaction. This smells like what I associate with, like, toothpaste. Oh. Yeah. Okay. So let's say one means the two smells are close.

Sorry. One. One means they're very different, and seven means they're very similar. How would you give it a number?

One. Like very different. Yeah. I think that also comes to what you mentioned before, which is you can tell the difference between banana and banana candy.

I that's also maybe the case. I wonder whether the smell can, sorry, whether the fragrance can make you, like, remind you of anything about strawberry.

No. No. It's just directly. Well, okay, the one thing that reminds me, like, if it had a color, it would be red, that fragrance, so it's like the right color, but it doesn't actually.

Other than color, nothing else can be associated with strawberries. Yeah. Okay. And how about this one? How about the, like, the real strawberry?

Does it smell like, that smell in your mind when you're describing the smell of It's like a, it's like a four, because.

Mm-hmm.-hmm. My parents used to grow strawberries, so I know what homegrown strawberries are, and they're a different breed than strawberries you get in the store, so when you smell strawberries in the garden, it's so much more than the strawberries you get in the store.

I see. Is it a very strong smell? Yeah, smell it across the whole garden. Well, I love to smell that, like the smell of strawberry, like a farmland of strawberry.

it's the same with tomatoes, like tomato in the store doesn't smell very much, but you can smell like a tomato across the garden and it's fresh.","Artificial: ""Very different"" (1/7) from real; smelled like ""cinnamon.""
Real: Confirmed as coffee, noting wide variability in bean notes.

Um, these are also like, these are like a one. I mean like this is difficult because coffee can smell so many different ways because like coffee is composed of a bunch of different notes but like this has like that roasted smell and it's not like super strong or anything in particular but this I'm getting like cinnamon in this one.

yeah, and there's no, um. There's no, like, no other smokier roasted scent in it, either. I see. Yeah. Does this smell like your coffee smell on your mind?

Yeah, like, basically. Like I said, there's, like, so many different kinds of coffee that, like, they can smell, like, wildly different.

But this is definitely coffee.","Artificial: Described as ""rancid"" and ""acidic,"" like a ""dead meat flower.""
Real: Dominated by American cheese and old grease, not the expected burger smell.

Yeah, okay, so like this burger doesn't smell like I imagined that burger to because the dominant smell is like cheese, specifically like American cheese, which has a specific smell, and so like that's not what I think about when I eat a burger usually, so smells different in the picture, but it just mostly smells like cheese, and old grease, and then this smells like there's like there's like sourness, an acidity, I think it's like, I think it's trying to like replicate the pickles, but that's about it, it's like almost rancid, like if I don't tell you this like a smell, or is the smell of burger, you cannot, no, it smells like um, you know those like flowers that like release like a dead meat smell, no, there's like some flowers that like release a dead meat smell, there's

It kind of smells like that, it's like a little bit rancid and acidic. I see. That's a weird description, but it's very interesting.","Artificial: Rated 2–3/7 vs. real; smelled like ""toothpaste.""
Key difference: Artificial lacked the ""planty"" rind/peel smell and the ""ethylene"" released by real bananas.

Yeah, this one also smells like toothpaste. Well, it smells specifically like the toothpaste that it did to me at the dentist when I was a kid.

But they don't smell the same. Well, maybe like a little bit the same. I think like a 2 or a 3.

But this one's missing a bunch of other things that are in it. What is missing? Um, I think, I don't know what it is, but I think it's like the, the like, ethylene that Bananas released, and like the rind.

Like, think like the, the rind itself, like the peel, has like, hmm, kind of a planty smell in it.

And then this is just like, purely banana, guess. But it's not even really banana, it's the wrong kind of banana.

Oh, wrong kind of banana. Yeah. Well, you know, like, that's why banana candy doesn't taste right. Yeah. Oh, yeah.

It's a different species of banana. That's also someone else, previously mentioned, like, that smells like the, the candy flavor of banana itself.

like the real banana, but yeah, I think that's also a good point, and our smelling task will end here"
007 (nomy),"Real: Fresher, less sweet.
Synthesized: Sweeter, ""chewing gum"" like.
Similarity: 6.5/7. Rationale → Both are recognizable as ""strawberry"" in a processed food context (e.g., candy, smoothie), making the difference less significant.
-----------------------------------------
Well, it was a bit different from what I thought, like, no, it's similar, but it's a bit, like, sweeter than what I remembered.

It's not that fresh. Yeah, exactly, yeah, yeah. I'd give it, like, a six. Boom. This smells more like, you know, chewing gum that tastes like strawberry, you know, because maybe that's also what they put in there, but yeah, 6.5.

Wow, that's a very high score. But I wonder, like, you think there are both, sorry, mean, this is not the right way to ask this, but I guess you can associate strawberry with both of them when you're smelling these two.

smells, but do you think those two are very similar, the smell? Yeah, they're not very different. Maybe it's very connected to the fact that when you buy food with the flavor of strawberry, you feel like you feel this.","Real: Strong, natural, ""nature.""
Synthesized: Artificial, diluted, more like liquid coffee than beans.
Similarity: 3/7. Rationale → The synthesized version lacked the strength and realism of real coffee beans.
-----------------------------------------
 I thought these are different, I would say like three, because this vaguely reminds me of that, but it's more artificial, this is more like, smells more like nature, so it's more realistic.

Would you use, can you use a bit, like a few more words to describe the smell of this? sure.

Yeah, it feels a bit more artificial, and maybe it smells more like actual coffee, like liquid coffee, more than instead the coffee beans, so.

So it's like it's more diluted, in a sense, like this is a bit more strong, you know? see, yeah, sure.","Real: Raw, less sweet, deeper, more realistic.
Synthesized: Artificial, sweeter, ""sauce-like,"" combined rather than distinct components.
Similarity: 3/7. Rationale → The synthesized version failed to capture the distinct, raw components of a real hamburger.
-----------------------------------------
This is, um, it smells a bit more artificial than what I was thinking, in the sense that, in my mind, I was thinking more about, like, the meat, and the cheese, and the bread, instead this is a more like a combined taste, like in my mind I was a bit separating those, you know?

Yeah, also feel like those are a bit different, uh, I say also three, because I feel like this is sweeter in the smell, and this is a bit, yeah, it's a bit more raw and a bit less sweet, and I feel like maybe, yeah, this reminds me more of like a sauce that you would put maybe inside or something like that, but yeah, this has a more like realistic smell, like more of a combined and, yeah, more, like a deeper smell.","Real: Fresher, natural.
Synthesized: Strong, ""banana smoothie"" like.
Similarity: 7/7. Rationale → The synthesized version is highly similar to real banana, reflecting how well banana flavor translates to processed foods compared to other fruits.
-----------------------------------------
It's also not fresh, but it has a stronger smell when it's not fresh.

Yeah, this is also very similar to what I remembered. Yes. Yeah, I had the exact same smell in my mind.

I would give this like a 7, because I feel like it's like my reasoning is similar than the strawberries, yeah exactly, because I feel like this tastes more like something you would eat like a, I don't know, a smoothie, like a banana smoothie, you know, so it's still a bit like not the same, this is like fresher and more natural as a smell, but I'm raising it a bit higher because I feel like, I don't know if you have the same feeling, but for example if you buy a strawberry smoothie, it tastes less like strawberry and instead of banana smoothie, it's more similar in the like smell and taste also, but yeah I can feel the same like sweetness and the background taste in sense, the smell, so yeah I feel like they're very similar.

I see, so I'll say it smells like some banana flavored candy food, yeah exactly, it doesn't smell that. It is close because I feel like if you have a banana candy, the banana candy taste and smell is very similar to the real banana, but still what I feel like it's a bit missing is the natural thing, because of course a banana is natural because it's the fruit, and instead when you have a flavor it's a bit less prominent in a sense, but it's still a bit closer than it's stronger."
008 ✅,,,,
009 ✅,"Real: very fresh, sour , smell fluftuating
Artificial: strawberry pie, very different, very sweet, very syrapy, consistent
Similarity: 2
-----------------------------------------
It smells like a strawberry pie. It smells very different. smells very sweet, very serapy. I think very different from the fresh strawberry, which is like very fresh and very sour.

And I think the smell in this one kind of dissipates after a while, but this one is like a much stronger smell that stays constant.

So there's no kind of fluctuating the smell. So I think that's why you could tell, or maybe because I'm like picking it up, that it's not from a real strawberry.","Real: very spice, latte, 
Artificial: nutty, cinnamon, more sweet, diluted, Dunkin coffee, milk, sitting out 
Similarity: 2
-----------------------------------------
Yeah, that makes sense. Yeah, smells very good. I think it's nutty and like very aromatic, like a bit of spice.

It smells like cinnamon, but I think it's a lot more sweet. Yeah, smells more like cinnamon than it does smell like what I think it would smell like.

Coffee, very spice. It smells like a latte, I guess. Yeah. It's a very specific version of coffee. So I don't think it has all the dimensions that the coffee has.

All dimensions. Well, I think it's a very nice display. Yeah, I think the same thing. Maybe it's really flat, the way you smell it.","Real: onion, gralic, bacon, cooking grease 
Artificial: oaky scent, orbeez, 
Similarity: 2
-----------------------------------------
It's like... Like an oaky scent? Yeah, smells like an Orbeez. Smell, like... What's the thing you would find in the diffuser?

It's only a one and how much it is. The burgers? I feel like you smell the cheese and the bacon...

Um... And I guess like when, it's like when you start cooking something in a pan with just onions, you smell that for the first time, so I don't know what the word for like onions and garlic are, but I think like once you smell that at the bacon, then you smell the cooking grease, and I think that's like not, almost opposite of what cooking grease is to me.","Real: banana
Artificial: ""plastic"", like candy, uber driver, sick of smelling, bubblegum
Similarity: 4
-----------------------------------------
Fresh cut grass? Yeah. It smells very like, it smells like a candy you just eat at the kitchen. It's very plastic, it's like very much plastic.

It's very pungent, like you can smell it right away. very, it's very sharp. And very like, what's the cooking machine?

It's sticky. Like something that if you smell it, the Uber driver has to smell in his car and you are on the ride for like 20 minutes plus, you just get sick of smelling it.

Like a thing you put in your car that like is supposed to like cover the snow of your car.

take the same place. That's want me smells like bubblegum. Yeah, thanks. Okay, you associate it with banana? No, I don't associate with banana.
"
010,missing,missing,missing,missing