Participants,Strawberry,Coffee Beans,Burger,Banana
001 ✅,"Real: Caramelized sugar, fresh, citrusy.
Artificial: Sweeter, less citrusy, ""strawberry shot"" with ethanol notes.
Similarity: High, despite differences.
-------------------------------------------
Okay, this caramelization flavor that comes through very much, definitely tastes like strawberry, which makes sense.
I feel like this has a bit of a ethanol smell as well. I would say it smells like a shot, like a strawberry shot. There's a bit of an alcohol tasted compared to that one.
But I also think that makes sense because the more riper they get, I think the more they've opened to this.
So that(artificial) smells sweeter than this thing(real). Taste profile-wise, I think it's very, very similar. 
I also feel like the artificial one is less citrusy than the real strawberry. Yeah, it just tastes a bit less natural.
Probably I'm a bit biased now. But it is. It's very natural. ","Real: Earthy, roasted.
Artificial: ""Makeup,"" rancid, pine-like, alcoholic.
Similarity: 1/7 (""totally different"").
-------------------------------------------
Let's start with the rear coffee. Okay, so it smells a bit more earthy than I thought it would, when I looked at the picture. Probably because it's cooked before, I don't know.
Another artificial one. It doesn't taste like coffee, pretty much. It tastes like makeup, I feel like. Also a bit of an alcoholic, like, ethanol smell to it.
And you don't get the roasty aromas as much as with the real coffee. It has a coffee. It smells a bit like coffee, that's for sure. Need to smell for a longer time, where it smells . Yeah. I can't just, I just know that there's like one makeup I don't use, but I know someone that smells like this, that's quite similar, it's like a bit, a bit rancy, this, this taste, or like also a bit, there's a, what are the Christmas trees called, this type of tree, yeah, yeah, like the type, not the Christmas tree itself, pine, pine, like, yeah, with, a pine tree flavor, it doesn't go with coffee, yeah.
But I feel like I have smelt this in a perfume before. Oh, yeah. It doesn't smell very .","Real: Beefy, sweet bun, roasted patty.
Artificial: ""Vape smoke,"" sour, rancid.
Similarity: 1/7 (""totally different"").
-------------------------------------------
Also, it smells sweeter than I thought it was. (Where do you think the sweetness comes from?) I feel like from the bun. Okay. feel like we're think make it? Okay. Oh, did let go. think it?
Probably that one is caramelized, but you get this roasted aroma from the burning decaramelization of the pet tea, so it's pretty similar to that.
It tastes like a burger, but it's less beefy than I thought it would. Is this the burger? It should be, it's supposed to be.

Okay, that doesn't smell like burger. It smells like... 
It smells like vape, the smoke of the vape. Really, it's very similar to... I don't... I don't you. I mean, yeah, it tastes, and it could be slightly befeated what I, what I, but I don't think so.
It's, it's sour, it's like, tastes a bit more sour than the burger, or what a burger should smell like.
And super rancid, the artificial smell, yeah, the artificial flavor, and that's, that's rancid, I wouldn't eat a burger that smells like this.","Real: Leathery, ripe, less tropical than expected.
Artificial: Oily (""olive oil""), rancid, sweeter.
Similarity: 5/7 (recognizable as banana).
-------------------------------------------
Ok, it smells way more leathery than what I thought it would be, less tropical than I had the banana.
That I thought the banana would smell like. Probably the inside smells a bit different, no? I mean, the longer it stays, usually the more, I don't know how to tell the smell as well, but, yeah, the stronger the smell is.
Okay, let's see. Okay, so that fishy flavor, it smells a bit more oily than what the banana smells like.
It's like olive oil. It smells very similar to olive oil. Which the banana doesn't smell like. Also a bit of this rancy flavor that the other fish, like, except for the strawberry, had.
Like, besides strawberry, other... The others had like a bit of a rancy flavor, like this one. I think that they can't probably...
Probably from the oil, I don't know, because oil also does have this sometimes. I also feel like the official one smells a bit sweeter than the real banana.
The banana smells a bit more ripe than the official flavor. But I don't know how to describe something that smells ripe.
It's like ripe fruit. Yeah. So from one to seven, how do you scrape the similarity? I would say... Five.
I mean, it smells like banana. If I would smell it, I would say yeah, banana."
002 ✅,"Real: Mild, sweet, flowery.
Artificial: Stronger, sweeter, sour, with a ""kick.""
Similarity: 5/7.
-----------------------------------------
So this is artificial. I think this one has kind of like a mild smell, so it's not very strong, it's very light.

And it smells quite nice, because it's all kind of sweet. Yeah. Mm. Mm. Mm. Mm. Mm. Mm. All And also a little bit kind of flowery smell, but I think this one is sour, it's very different.

It's definitely stronger than the real strawberry. You mean concentration wise? Concentration wise, yeah. And it also kind of like gives you a more, how do you say, like a kick, like at the back of your nose.

Yeah, because this one is kind of like, it's on the surface, and this one I feel like it's much stronger, think?

Yeah, like this one's definitely sweeter. Sweeter and sour, I think. Yeah. I don't know, this is my, yeah, feeling.

I would definitely prefer this one. Sure. Yeah. Let's say from one to seven. One means they are totally different from each other, and seven means like the two smells are super close.","Real: Recognizable coffee aroma.
Artificial: Unrecognizable; smelled like ""Chinese medicine"" or ""something gone bad.""
Similarity: Not rated due to extreme dissimilarity.
-----------------------------------------
And I believe it's this. That's good. Oh. Are you sure this is coffee? That's also the question the last participant asked.

Okay. Coffee is already special. Oh. Oh. I think these are two different types of smells. This one is the one that I remember.

Yeah. Mm-hmm. I think it's kind of like... Hello! Hello! Can I take a look at your ear? Oh, is it just on the right side?

It happens! But when I smell more of this, I think they are more similar. Maybe my brain is processing?

Because they give me a hint that they are the same. But the first time I smell it, it's very different.

Yeah, but if they don't tell you, like, this is the smell of coffee beans. I would probably say it's something else.

What would be something that you describe this? Yes. I'm the first one. Oh, I'm I'm first missteps. can't don't what's that?

I'm Okay, Thank you. It's sour, I think. Yeah. It's similar to that one. just feels like, um, do you have a word for a medicine?

Yeah. Oh, yeah. It almost smells like something's gone bad. It's like a food. It's like, it's been there for a while.

Yeah. Soil sauce? No. Maybe like Chinese medicine, I think. Yeah. Okay. But I kind of agree as well. Okay.

Sure. Um, so I guess I don't need to ask, like, from one to seven. ","Real: Meat-dominant, greasy, salty (from an overnight burger).
Artificial: Weak, sweet, fruity (like strawberry), with no meat or cheese notes.
Similarity: 2–3/7.
-----------------------------------------
This is what I bought last night. We heated it up a little bit, but it's still getting cold right now.

How do you describe it? It's smoky, right? Yeah. Kind of salty. Yeah. Very greasy. Yeah. Is this a smell that also your mind?

I But the burger smell, I imagine, from the picture is better than this one. Oh. Probably that one is fresh, and this one is kind of like overnight.

Yeah. Yeah, probably. And also that one has bacon. Mm. So that would be kind of more smoky. Oh. Yeah.

Actually, there's bacon inside, but you can not see it, you can not smell it. Yeah, but I think this is a kind of, like, more meat kind of smell.

So, it's definitely associated with your, like, your appetite. So, yeah, it's less buttery, because I use buttery, yeah, when I saw the picture.

But this is more kind of like meat dominant smell, yeah. And this is the fragrance, but I guess it's kind of strong, so you can move it a further away from your nose to smell it.

Oh, okay. Wow. You have a burger smell. It's not very strong. Okay. Yeah. Thank you. I think the real burger is stronger.

I think the similarity between these two would be like maybe two or three. Because this one doesn't smell like cheese.

Yeah. How would you describe the smell? My face is similar to strawberry smell. Only this color is. Yeah. And it doesn't smell like meat at all.

Right, but it's smoky. No, it's not smoky. Yeah. Yeah. So I would say one similarity, just one. Yeah, sure.

But it's hard to describe what it is. I'm not associating it with anything in particular, but not burger. Yeah.

More like strawberry.","Real: Sweet, soft, refreshing (from a ripe banana).
Artificial: Overly sweet, intense, reminiscent of ""clay"" or ""cough syrup.""
Similarity: 5/7.
-----------------------------------------
This is... Wait, I'll check. Hmm. This smells good. Hmm. Yeah, banana is definitely very sweet. And this is quite ripe.

So it has kind of like the softness of the smell, but also like refreshing. And I like it. What Yeah.

What does that mean? It smells like, uh, clay. Oh. It's very artificial. Yeah. That's right. That's also what I, like, recall after I smelled this.

It's like the colorful clay we used to play with. Yeah. Play gold. Yeah. Yeah. It's too sweet. Um, and also it has kind of, it, it reminds me of the, the syrup you used to have when you have a fever or cough.

Oh, cough. Yeah. Like the really sugary kind of syrup. Yeah. Um. I don't like this. Smell. But I think it's kind of similar because I can still associate it with banana.

It definitely has the distinguished smell of banana. But it's just kind of like very artificial, very sweet, overwhelming. Yeah.

So I would give like five. Yeah. Sure. Wow. That's actually the same score the last, the previous. Really? Okay."
003 ✅,"Real: Gentle, pleasant, natural.
Artificial: Sharper, stronger, ""medicinal,"" like candy.
Similarity: 3.5
-----------------------------------------
So this one pretty much smells exactly as I'd expect it to. It has that sweetness to it.
It's very pleasant. This one, it's much more artificial. It smells almost like the strawberry candy, which I guess would make sense.
Say-hosted a It's It's like, almost, it's like sharper. It's like, it's not really something I would want to like, linger in a space all day, while this I could feel like I could smell this all the time.
It's sharper, it's more artificial. It's almost more like medicinal, I would say. It's, yeah, it's definitely a stronger smell, like, um, this, this kind is more gentle, I would say, which makes this more pleasant.
How would you rate the smell? I would say, like, 3.5. Right in the middle. Right in the middle. Like, I can tell they're supposed to be the same, but I think the difference, and I know from, like, from cultural context that they are supposed to be the same, but I think, I think. They're different enough that, yeah, that I can distinctly tell them apart. ","Real: Pleasant but less rich/dark than expected.
Artificial: Weaker, less deep, ""simulation,"" slightly artificial.
Similarity: 5.5
-----------------------------------------
So I think, again, they smell pretty close to my expectations.
This one's not quite as, like, rich as I would expect some coffee beans to be. It smells good. It's still, like, pleasant.
But I feel like it's not quite as, like, dark or kind of thick as someone. Some I've smelled before.
But, you know, I think it's still pretty pleasant. This one smells pretty similar. I think it's a little weaker.
Maybe it's less deep of a smell. It smells like a simulation. It lacks some of the depth. It's still a little bit artificial, but it's definitely closer than the strawberries.
And they're both pretty pleasant. Great. How would you rate the similarity? I would say five and a half. ","Real: Mostly meat, possibly dulled by being cold.
Artificial: Unrecognizable as food; sharp, ""medicinal.""
Similarity: 2
-----------------------------------------
I'm not a big fan of either of the smells, personally, but I think in this case, this smells very meaty.
I'm not sure, yeah, like you said, maybe it's a little colder, but I'm getting like almost all meat, like I'm not really smelling anything else.
This one, honestly, I'm not even sure I would be able to tell that it's a cheeseburger. It's kind of weird.
It's like almost a little like savory. But there's like a sharpness to it that makes it seem not food.
Again, it's a little like medicinal. Yeah, I don't know. It's not something I would want to like, if I were hungry, I wouldn't want to smell this.
Or I'm not a big burger fan in general, but like this one, you know, I, you know, when I smelled it there, I smelled the bread a little bit.
Um, like I was saying, like a little bit of sweetness. Mostly meat. This one, yeah, I don't know. I don't think I'd be able to place this.
Maybe I can... Kind of tell since they're next to each other, but if the burger wasn't here, I don't think I'd be able to guess. Like to guess it's a cheeseburger. It's a cheeseburger. So I would say like, like a two for similarity.","Real: Expected, sweet-ish, musky.
Artificial: Sharper, like candy; surprisingly preferred over the real scent.
Similarity: 3
-----------------------------------------
So again, a banana smells what I would expect it to.
It smells like the Banana Lounge or something. It's... Yeah, like I said, it's sweet-ish. Not the most pleasant fruit in the world.
Not something I'd want to like linger in a space all day. So kind of like wafts, wafts through like a little musky.
Funny, think, again, it's a little artificial, but I almost prefer this, the smell of this one. I can tell it's supposed to be banana, because it smells like banana candies and things like that I've had before.
I don't think it's, again, super close. I think, again, think all these artificial ones have a sharpness that the real object doesn't have.
But actually, I think I prefer the smell of this one. Yeah. Okay, and how about similarity ranking? Yeah, it's funny, because it's not super close. So pleasantness aside, think it's like a three."
004 ✅,"Artificial: ""Strawberry candy"" or ""cough medicine""—syrupy sweet, lacking earthiness.
Similarity Score: 5/7
-----------------------------------------
Yeah, actually that smells more strongly than I remembered the smell. Yeah, yeah, yes. I hate that I'm going to say.
It smells like strawberry candy. Oh. The candy, obviously, smells like the strawberry, but it's still sweet, but there's more dirtiness in it than I think I remembered there being.
This is much sweeter than the actual strawberry is. It has like an almost syrupy... staggy of a larva, and it doesn't have the same earthiness in it. So you're mostly getting sweet. It smells a little bit like a cough medicine.
Oh, I heard a lot of times about It's a bad I kind of like it. Back to the real strawberry.
Sure. It has freshness. smells like freshness. It smells too sweet. It smells like sweet. I totally got it. Yeah.

Five. Still close, but not that much. I can recognize that this is in the direction of fruit and strawberry.
It's definitely not an opposite sort of smell. It's not sour and bitter or something. But it doesn't capture just the strawberry-ness in some sense.
It's missing the planty part, the sweetness it adds. It's like too artificial, maybe? Yeah.","Artificial: ""Sharper"" and sweeter, with a nutty profile (5/7) vs. the real beans' fruity profile (5/7).
Similarity Score: 6/7
-----------------------------------------
And I think this should be good. Oh, no, this one. Yeah, there's bad smell coming. Yep, this one. Yeah, that's certainly coffee.
It smells less roasted, which could be because of, like, whatever roast it is. A little nutty. The main thing I'm getting is sort of, like, the nutty smell. That's pretty close. Maybe coffee is easier to replicate. I'm getting the fruitiness, the nuttiness.
This is a little sweeter than that. So again, it's like the artificial one that's sweeter than the real coffee.
Yeah. It doesn't smell artificial though, it's just like more... Okay. It doesn't smell artificial. No. It smells like... Oh, that's a...
It's definitely a recognizably coffee. 
I don't know how to describe that differently. It's not stronger, but it's sharper. So to put numbers on it, this is more nutty, that is more fruity, so we'll do like five nutty and three fruity.
That one smells like that much like plants. mean, like nuts and fruits are plants, but not like earthy. And this one, less nutty, more.
More sweet and fruity, so we could put like five for the fruity, three for the muddy, and then this one has a bit of sweetness, so one, no, two, for the sweetness.
And then for the comparison, six, they're pretty similar, just a little bit different. Great. And then let's move on to hamburger.","Artificial: Smelled only of ""sweetness,"" with no recognizable burger components.
Similarity Score: 2/7
-----------------------------------------
That definitely overpowers everything else that's in here. That was way sweeter. It's hard to get anything out of this that isn't just, like, sweetness.
Can you tell that something like burger from that? Not really. You smell it a little more, like, acidic and vinegary, which, like, I said I would expect from the burger, but it didn't cut through strongly.
There's, a little bit of sweetness in here also. Not, like, the meat smell is not really. Far away from meat.
Yeah, and these might be, like, a two in their similarity. ","Artificial: ""Banana-flavored candy""—overly sweet and artificial, missing the plant/earthy notes.
Similarity Score: 6/7
-----------------------------------------
That's definitely a banana smell. Sweet, flat-like, with different part of the smell.
They didn't, I was just seeing if they did. The sweetness. I feel like artificial bananas are pretty good, usually.
Oh, way sweet. And it was in, like, a, there was a little, there was a candy, that was like, they were like,
Tiny little fruit-shaped, like, hard sugar candies. Yeah, yeah, yeah. I had the same thing, actually, when I smelled this.
Yeah, it smells like that banana. It's like the banana-flavored candy. Yes. I mean, you know, that's probably because it's very similar to whenever they use the flavor of the banana-flavored candy.
Yeah, this is much sweeter than the actual banana, but definitely, like, it's, I mean, it's either that it smells like banana, or I strongly associate the smell of banana, just from the candy and whatnot.
But it, like, like, sweetness, it's artificial smelling. But that's not like banana.-hmm. It's rather, it's, a... Yeah, again, I think what's missing is, like, the little, a bit of the, like, the plant smell, the earthiness.
yeah. Agree. Totally agree. Okay, but, like, you know, like a six, like, very obviously banana. Mm-hmm. So it's like, I can easily tell this is the smell of banana.
Oh, no, no, But it's The real banana is the banana flavored, something Yeah, I can tell that it's not an actual banana. It's an artificial banana flavored. "
005 ✅,"Real: less strong, grassy
Artificial: Syrupy, strawberry, cherry, liquor, laffy taffy, strawberry candy
Similarity: 3
-----------------------------------------
The difference I would describe here is that this one is from a syrupy. I would say that this one is actually pretty close.

You can tell that it's meant to be either strawberry or cherry. But this one's less strong. This one has a more grassy smell to it.

This one does have a little bit of a, like, a... ... A liquor smell, kind of. From one to seven.

Seven means they're just not very close to each other. Let's say four. I know that's a meal. I guess.

Sorry. I'm really, I think that, let's call it a three. I think that I can tell that it's meant to be strawberry.

But if I did smell it, I wouldn't think of a strawberry field or something like that. But I think here I would be very much like, oh, totally.

Like, this one, they're both memories, I think, in a way. Like, this one reminds me of... Like a Laffy Taffy, something like that.

Not of a strawberry, per se. So you will choose to eat something that smells like that? I think I wouldn't...

If someone gave me a strawberry that smelled like this, I wouldn't eat it. But if they gave me a strawberry candy that smelled like this, I would totally eat it.","Real: Stronger
Artificial: coffee out for a second, water, less overpowering, sleeping, water, diluted, Dunkin coffee, milk, sitting out 
Similarity: 5
-----------------------------------------
I'd say, the real one, smells a lot stronger, right here.

This one definitely smells like, this one's actually pretty close though. Coffee that's been hot for a second, whereas this one, this wasn't off.

But, I would, this one, I'd say yeah, this one's weaker, less overpowering, smells like it's like sleeping. Water, or maybe even it has milk in it or something, like it totally smells like a, I don't know, coffee, like dunking coffee or something that's been sitting out.

I'd say this one's, uh, similar.","Real: Burger
Artificial: Cheesy
Similarity: 2
-----------------------------------------
This one very much smells like an burger. I think this one... I don't smell this... ...the cheese was like a little bit...

...the... ...the... ...the... ...the... Yeah, it's mostly. I would say it's a two. Ah, that's it.","Real: Similar, not good smell, 
Artificial: ""pleasant"", like candy.
Similarity: 6
-----------------------------------------
Even more so than the strawberry, I can definitely tell that this is meant to be banana. I think here I'm smelling the outside of the banana and not the inside.

So there is a bit of a difference in the smell. But this is... So it would be stronger than one of banana's smells, but the banana smells fairly similar.

The banana itself has a little more like a, not good smell to it. I think this one, this one smells like it doesn't have the, I don't know.

And this one, this one smells like a candy again, I'd say. Whereas I think bananas sometimes do have a little bit of like a less pleasant smell to them.

Not that I would put this in like a living room or something, but I would definitely eat a candy than this.

I had to give it a number. I'd say this one's closer to a six. Yeah, I guess we're pretty much finished.
"
